{
  "schema_version": 1,
  "kind": "benchmark.run",
  "run_id": "schema_fixture",
  "run_mode": "REPLAY",
  "events": [
    {
      "schema_version": 1,
      "event_type": "run.started",
      "run_id": "schema_fixture",
      "elapsed_ms": 0,
      "run_mode": "REPLAY",
      "recipe": {
        "concurrency": 1,
        "max_tokens": 8,
        "model_label": "fixture",
        "telemetry_mode": "SSE CHUNK MODE"
      }
    },
    {
      "schema_version": 1,
      "event_type": "stream.started",
      "run_id": "schema_fixture",
      "request_id": "req_schema_fixture_00",
      "stream_index": 0,
      "elapsed_ms": 10,
      "mode": "SSE CHUNK MODE"
    },
    {
      "schema_version": 1,
      "event_type": "stream.delta",
      "run_id": "schema_fixture",
      "request_id": "req_schema_fixture_00",
      "stream_index": 0,
      "elapsed_ms": 42,
      "mode": "SSE CHUNK MODE",
      "sequence": 0,
      "text": "hello ",
      "token_ids": [101]
    },
    {
      "schema_version": 1,
      "event_type": "stream.completed",
      "run_id": "schema_fixture",
      "request_id": "req_schema_fixture_00",
      "stream_index": 0,
      "elapsed_ms": 100,
      "mode": "SSE CHUNK MODE",
      "sequence": 1,
      "status": "success",
      "finish_reason": "stop",
      "usage": {
        "prompt_tokens": 2,
        "completion_tokens": 1,
        "total_tokens": 3
      }
    },
    {
      "schema_version": 1,
      "event_type": "run.completed",
      "run_id": "schema_fixture",
      "elapsed_ms": 120,
      "summary": {
        "requested_concurrency": 1,
        "active_count": 0,
        "completed_count": 1,
        "failed_count": 0,
        "wall_time_ms": 120,
        "total_completion_tokens": 1,
        "aggregate_decode_tok_s": 8.333,
        "ttft_ms": 32,
        "completion_count": 1,
        "throughput_distribution": [
          {
            "stream_index": 0,
            "completion_tokens": 1,
            "wall_time_ms": 90,
            "tok_s": 11.111,
            "status": "success",
            "ttft_ms": 32,
            "failure_kind": null
          }
        ],
        "failure_labels": [],
        "winning_recipe": "fixture"
      }
    }
  ],
  "summary": {
    "requested_concurrency": 1,
    "active_count": 0,
    "completed_count": 1,
    "failed_count": 0,
    "wall_time_ms": 120,
    "total_completion_tokens": 1,
    "aggregate_decode_tok_s": 8.333,
    "ttft_ms": 32,
    "completion_count": 1,
    "throughput_distribution": [
      {
        "stream_index": 0,
        "completion_tokens": 1,
        "wall_time_ms": 90,
        "tok_s": 11.111,
        "status": "success",
        "ttft_ms": 32,
        "failure_kind": null
      }
    ],
    "failure_labels": [],
    "winning_recipe": "fixture"
  }
}
